{
    "schema_version": "mcp_record_episode_response.v1",
    "status": "recorded",
    "client_episode_id": "client_ep_01J0ACR001",
    "idempotency_key": "idem_01J0ACR001",
    "episode_id": "ep_01J0ACR001",
    "created_at": "2026-07-10T14:10:01Z",
    "redaction_state": "active",
    "duplicate": false,
    "scope": { "branch": "main", "commit_sha": "22e472d" },
    "transcript_disposition": "not_submitted"
}
